<?xml version="1.0" encoding="UTF-8"?>
<?xml-stylesheet type="text/xsl" href="test.xsl"?>
<ChristUniversity xmlns:xsi="http://www.w3.org/2001/XMLSchema-instance" xsi:noNamespaceSchemaLocation="emp1.xsd">
   <Faculty>
      <Name>Rithul</Name>
      <No._of_Organizations_worked_with>10</No._of_Organizations_worked_with>
      <Years>22</Years>
   </Faculty>
   <Faculty>
      <Name>Indu</Name>
      <No._of_Organizations_worked_with>3</No._of_Organizations_worked_with>
      <Years>14</Years>
   </Faculty>
   <Faculty>
      <Name>Kevin</Name>
      <No._of_Organizations_worked_with>2</No._of_Organizations_worked_with>
      <Years>10</Years>
   </Faculty>
</ChristUniversity>
